{
  "$schema": "https://json-schema.org/draft/2020-12/schema",
  "$id": "https://contracts.making-tracks.app/manifest/1",
  "title": "RegionManifest",
  "description": "Per-region, per-publish manifest. Written last, atomically (§5.2). Self-contained: the app can verify every tile and the basemap it references. Untrusted input: every string is bounded, filenames cannot traverse.",
  "type": "object",
  "additionalProperties": false,
  "required": ["schema_version", "min_reader_version", "region", "publish_version", "tile_z", "tiles", "counts", "basemap", "provenance"],
  "properties": {
    "schema_version": {"type": "integer", "const": 1},
    "min_reader_version": {"type": "integer", "minimum": 1},
    "region": {"type": "string", "minLength": 1, "maxLength": 64, "pattern": "^[a-z][a-z0-9_]*$"},
    "publish_version": {"type": "string", "pattern": "^[0-9]{8}T[0-9]{6}Z$"},
    "generated_at": {"type": "string", "maxLength": 32, "pattern": "^[0-9]{4}-[0-9]{2}-[0-9]{2}T[0-9]{2}:[0-9]{2}:[0-9]{2}(\\.[0-9]+)?Z$"},
    "tile_z": {"type": "integer", "const": 10},
    "tiles": {
      "type": "array",
      "maxItems": 1048576,
      "items": {
        "type": "object",
        "additionalProperties": false,
        "required": ["x", "y", "sha256", "bytes"],
        "properties": {
          "x": {"type": "integer", "minimum": 0, "maximum": 1023},
          "y": {"type": "integer", "minimum": 0, "maximum": 1023},
          "sha256": {"type": "string", "pattern": "^[0-9a-f]{64}$"},
          "bytes": {"type": "integer", "minimum": 1, "maximum": 1048576}
        }
      }
    },
    "counts": {
      "type": "object",
      "additionalProperties": false,
      "required": ["total", "by_tier"],
      "properties": {
        "total": {"type": "integer", "minimum": 0},
        "by_tier": {"type": "array", "minItems": 4, "maxItems": 4, "items": {"type": "integer", "minimum": 0}}
      }
    },
    "basemap": {
      "type": "object",
      "additionalProperties": false,
      "required": ["filename", "maxzoom", "sha256", "bytes", "bbox"],
      "properties": {
        "filename": {"type": "string", "maxLength": 128, "pattern": "^[a-z0-9][a-z0-9._-]{0,123}\\.pmtiles$"},
        "maxzoom": {"type": "integer", "const": 14},
        "sha256": {"type": "string", "pattern": "^[0-9a-f]{64}$"},
        "bytes": {"type": "integer", "minimum": 1, "maximum": 3221225472},
        "bbox": {"type": "array", "minItems": 4, "maxItems": 4, "items": {"type": "number", "minimum": -180, "maximum": 180}}
      }
    },
    "provenance": {
      "type": "array",
      "minItems": 1,
      "maxItems": 32,
      "description": "Prompt-version set that produced this tiering (§5.2 + task_id fix).",
      "items": {
        "type": "object",
        "additionalProperties": false,
        "required": ["task_id", "model", "prompt_version"],
        "properties": {
          "task_id": {"type": "string", "enum": ["score", "curiosity", "blurb", "category", "reconcile"]},
          "model": {"type": "string", "minLength": 1, "maxLength": 128},
          "prompt_version": {"type": "string", "minLength": 1, "maxLength": 64}
        }
      }
    },
    "attribution": {
      "type": "array",
      "maxItems": 32,
      "description": "Per-source credits for sources actually present in this publish. Non-empty attribution requires min_reader_version >= 2 so readers that cannot render credits refuse rather than mis-credit.",
      "items": {
        "type": "object",
        "additionalProperties": false,
        "required": ["source", "license", "text"],
        "properties": {
          "source": {"type": "string", "minLength": 1, "maxLength": 32, "pattern": "^[^\\u0000-\\u001f\\u007f-\\u009f\\u200b\\u200c\\u200d\\u2028\\u2029\\u202a-\\u202e\\u2060\\u2066-\\u2069\\ufeff]*$"},
          "license": {"type": "string", "minLength": 1, "maxLength": 32, "pattern": "^[^\\u0000-\\u001f\\u007f-\\u009f\\u200b\\u200c\\u200d\\u2028\\u2029\\u202a-\\u202e\\u2060\\u2066-\\u2069\\ufeff]*$"},
          "text": {"type": "string", "minLength": 1, "maxLength": 512, "pattern": "^[^\\u0000-\\u001f\\u007f-\\u009f\\u200b\\u200c\\u200d\\u2028\\u2029\\u202a-\\u202e\\u2060\\u2066-\\u2069\\ufeff]*$"}
        }
      }
    }
  }
}
