{
  "schema_version": 1,
  "min_reader_version": 1,
  "region": "uk",
  "publish_version": "20260714T120000Z",
  "generated_at": "2026-07-14T12:00:00Z",
  "tile_z": 10,
  "tiles": [
    {
      "x": 511,
      "y": 340,
      "sha256": "0000000000000000000000000000000000000000000000000000000000000000",
      "bytes": 812
    }
  ],
  "counts": {"total": 1, "by_tier": [1, 0, 0, 0]},
  "basemap": {
    "filename": "uk.pmtiles",
    "maxzoom": 14,
    "sha256": "1111111111111111111111111111111111111111111111111111111111111111",
    "bytes": 1500000000,
    "bbox": [-8.65, 49.84, 1.77, 60.86]
  },
  "provenance": [
    {
      "task_id": "curiosity",
      "model": "open-weight-x",
      "prompt_version": "curiosity-v3"
    }
  ]
}
